{
  "schema_version": "CAPABILITY_ADMISSION_RESULT-v1",
  "compilation_reference": "sha256:compile001",
  "candidate_reference": "sha256:candidate001",
  "admission_status": "ADMITTED",
  "admission_timestamp": "2026-08-20T10:30:00Z",
  "registry_gate_result": "PASS",
  "failure_reason_class": null,
  "bridge_identity": "host-admission-bridge-v1"
}
